{
  "schema_version": "2.0.0",
  "generated_at": "2026-10-22T08:22:43Z",
  "knowledge_base_version": "2026-08-30T14:11:08Z",
  "generator_model": "poolside:poolside/laguna-s-2.1",
  "ordered_topics": [
    "meio_ambiente",
    "midia",
    "impostos",
    "lgbtq",
    "armas",
    "indigenas",
    "previdencia",
    "educacao",
    "seguranca",
    "aborto",
    "corrupcao"
  ],
  "topics": {
    "meio_ambiente": {
      "topic_label_pt": "Meio Ambiente",
      "topic_label_en": "Environment",
      "divergence_score": 0.8333333333333334,
      "question_pt": "Como o Brasil deve equilibrar desenvolvimento econômico e proteção ambiental?",
      "question_en": "How should Brazil balance economic development and environmental protection?",
      "generation_quality": {
        "validated": true,
        "validator_model": "nvidia:z-ai/glm-5.2",
        "validation_date": "2026-10-22T08:14:57Z"
      },
      "options": [
        {
          "id": "opt_a",
          "text_pt": "Defendo que o governo amplie recursos para licenciamento ambiental com prazos máximos e decisões publicadas na internet, com prazo definido e prestação de contas.",
          "text_en": "I believe the government should expand funding for environmental licensing with maximum deadlines and published decisions, with a set deadline and accountability.",
          "weight": 3,
          "candidate_slug": "lula",
          "position_type": "confirmed",
          "confidence": "high",
          "source_pt": "Lula defende o meio ambiente através do fortalecimento de órgãos fiscalizadores, da reativação do Fundo Amazônia e do combate ativo ao desmatamento. Durante seu governo, houve uma redução de mais de 50% no desmatamento na Amazônia e o país sediou a COP30.",
          "source_en": "",
          "source_url": "https://pt.wikipedia.org/wiki/Luiz_Inácio_Lula_da_Silva",
          "source_date": "2026-03-25"
        },
        {
          "id": "opt_b",
          "text_pt": "Acredito que regulamentações ambientais excessivas sobrecarregam produtores e empreendedores, e por isso devemos simplificar o licenciamento para projetos econômicos que não impliquem grandes impactos.",
          "text_en": "I believe excessive environmental regulations burden producers and entrepreneurs, so we should simplify licensing for economic projects that do not involve major impacts.",
          "weight": -2,
          "candidate_slug": "flavio-bolsonaro",
          "position_type": "inferred",
          "confidence": "medium",
          "source_pt": "O candidato, de acordo com o posicionamento de seu partido (PL), é crítico de restrições ambientais e defende a flexibilização do licenciamento ambiental.",
          "source_en": "",
          "source_url": "https://pt.wikipedia.org/wiki/Flávio_Bolsonaro",
          "source_date": "2026-03-25"
        },
        {
          "id": "opt_c",
          "text_pt": "Minha posição é que o governo restrinja fiscalização do desmatamento com operações anuais, multas públicas e embargo imediato, com indicadores trimestrais públicos.",
          "text_en": "I hold the government should limit deforestation enforcement with annual operations, public fines and swift embargoes, with public quarterly indicators.",
          "weight": -2,
          "candidate_slug": "caiado",
          "position_type": "inferred",
          "confidence": "medium",
          "source_pt": "Como governador, Ronaldo Caiado promulgou uma lei que autoriza a extração e o beneficiamento de amianto para exportação, uma prática alvo de questionamentos judiciais devido aos impactos ambientais e de saúde. Além disso, seu partido mantém uma postura crítica a restrições ambientais que considera excessivas.",
          "source_en": "",
          "source_url": "https://pt.wikipedia.org/wiki/Ronaldo_Caiado",
          "source_date": "2026-03-25"
        },
        {
          "id": "opt_d",
          "text_pt": "Na minha visão, é preciso equilibrar preservação de áreas sensíveis com investimentos em tecnologias limpas que permitam desenvolvimento sustentável sem bloquear todo avanço produtivo.",
          "text_en": "In my view, we must balance the preservation of sensitive areas with investments in clean technologies that enable sustainable development without blocking all productive progress.",
          "weight": 0,
          "candidate_slug": "zema",
          "position_type": "inferred",
          "confidence": "medium",
          "source_pt": "Defende um equilíbrio entre a preservação ambiental e o desenvolvimento econômico, criticando o excesso de regulações na área.",
          "source_en": "",
          "source_url": "https://pt.wikipedia.org/wiki/Romeu_Zema",
          "source_date": "2026-03-25"
        },
        {
          "id": "opt_e",
          "text_pt": "Minha posição é que políticas ambientais rígidas podem gerar resistência do setor produtivo, mas ainda assim acredito em normas claras que não sufocam o crescimento e que incentives inovação verde.",
          "text_en": "My position is that rigid environmental policies can generate resistance from theproductive sector, but I still believe in clear standards that do not suffocate growth and that encourage green innovation.",
          "weight": 0,
          "candidate_slug": "renan-santos",
          "position_type": "inferred",
          "confidence": "medium",
          "source_pt": "Renan Santos e o MBL frequentemente criticam o ativismo ambiental politizado, enfatizando a importância do desenvolvimento econômico. Eles argumentam que políticas ambientais excessivamente rígidas podem impedir o progresso econômico.",
          "source_en": "",
          "source_url": null,
          "source_date": "2026-03-25"
        }
      ]
    },
    "midia": {
      "topic_label_pt": "Regulação de Mídia",
      "topic_label_en": "Media Regulation",
      "divergence_score": 0.8333333333333334,
      "question_pt": "Qual deve ser o papel do Estado na regulação de mídia e plataformas digitais?",
      "question_en": "What should be the State's role in regulating media and digital platforms?",
      "generation_quality": {
        "validated": true,
        "validator_model": "nvidia:z-ai/glm-5.2",
        "validation_date": "2026-10-22T08:15:50Z"
      },
      "options": [
        {
          "id": "opt_a",
          "text_pt": "Defendo que o Estado crie uma autoridade independente com poder de multa e remoção de conteúdos para coibir ataques deliberados à democracia e à integridade física de cidadãos nas grandes plataformas digitais.",
          "text_en": "I advocate for the creation of an independent state body with the power to fine and remove content to curb deliberate attacks on democracy and the physical integrity of citizens on major digital platforms.",
          "weight": 2,
          "candidate_slug": "lula",
          "position_type": "inferred",
          "confidence": "medium",
          "source_pt": "O Partido dos Trabalhadores (PT), do qual Lula faz parte, é favorável à regulação de plataformas digitais e ao combate à desinformação.",
          "source_en": "",
          "source_url": "https://pt.wikipedia.org/wiki/Luiz_Inácio_Lula_da_Silva",
          "source_date": "2026-03-25"
        },
        {
          "id": "opt_b",
          "text_pt": "Sustento que o governo restrinja moderação de conteúdo com direito de resposta e prazos de recurso, com revisão periódica e relatório público.",
          "text_en": "I contend the government should limit content moderation with right of reply and appeal deadlines, with periodic review and public reporting.",
          "weight": -2,
          "candidate_slug": "flavio-bolsonaro",
          "position_type": "inferred",
          "confidence": "medium",
          "source_pt": "Como filiado ao PL, Flávio Bolsonaro se alinha ao partido que é crítico à regulação de redes sociais e defende a ampla liberdade de expressão.",
          "source_en": "",
          "source_url": "https://pt.wikipedia.org/wiki/Flávio_Bolsonaro",
          "source_date": "2026-03-25"
        },
        {
          "id": "opt_c",
          "text_pt": "Entendo que o papel do Estado seja apenas fiscalizar e exigir transparência sobre algoritmos e fontes de financiamento, sem impor regras de conteúdo que restringam a liberdade de expressão.",
          "text_en": "I understand that the State's role should be only to monitor and require transparency regarding algorithms and funding sources, without imposing content rules that restrict freedom of expression.",
          "weight": -2,
          "candidate_slug": "caiado",
          "position_type": "inferred",
          "confidence": "medium",
          "source_pt": "O partido de Ronaldo Caiado, o União Brasil, é contrário à censura de redes sociais.",
          "source_en": "",
          "source_url": "https://pt.wikipedia.org/wiki/Ronaldo_Caiado",
          "source_date": "2026-03-25"
        },
        {
          "id": "opt_d",
          "text_pt": "Na minha visão, o Estado deve regulamentar apenas para garantir que plataformas não deempreferencia a editores ou veículos de comunicação por ordem de pagamento, evitando monopólios informativos sem censurar conteúdo.",
          "text_en": "In my view, the State should regulate only to ensure that platforms do not give preference to publishers or media outlets based on payment order, preventing information monopolies without censoring content.",
          "weight": -2,
          "candidate_slug": "zema",
          "position_type": "inferred",
          "confidence": "medium",
          "source_pt": "O candidato, sendo do Partido Novo, provavelmente acompanha a posição contrária à regulação de mídias e a favor do livre mercado defendida por sua legenda.",
          "source_en": "",
          "source_url": "https://pt.wikipedia.org/wiki/Romeu_Zema",
          "source_date": "2026-03-25"
        },
        {
          "id": "opt_e",